{
  "$schema": "https://json-schema.org/draft/2020-12/schema",
  "title": "Axis entity",
  "type": "object",
  "additionalProperties": false,
  "required": ["id", "kind", "name", "formatVersion", "fields"],
  "properties": {
    "id": { "$ref": "#/$defs/id" },
    "kind": { "const": "entity" },
    "name": { "$ref": "#/$defs/name" },
    "formatVersion": { "const": 1 },
    "label": { "$ref": "#/$defs/textReference" },
    "displayField": { "type": "string" },
    "fields": {
      "type": "array",
      "minItems": 1,
      "items": { "$ref": "#/$defs/field" }
    },
    "validations": {
      "type": "array",
      "items": { "$ref": "#/$defs/validation" }
    },
    "indexes": {
      "type": "array",
      "items": { "$ref": "#/$defs/index" }
    }
  },
  "$defs": {
    "id": {
      "type": "string",
      "format": "uuid",
      "pattern": "^[0-9a-fA-F]{8}-[0-9a-fA-F]{4}-[0-9a-fA-F]{4}-[0-9a-fA-F]{4}-[0-9a-fA-F]{12}$"
    },
    "name": {
      "type": "string",
      "pattern": "^[A-Za-z][A-Za-z0-9]*$",
      "maxLength": 60
    },
    "textReference": {
      "type": "object",
      "additionalProperties": false,
      "required": ["textKey"],
      "properties": {
        "textKey": { "type": "string", "minLength": 1, "x-axis-reference": "text" }
      }
    },
    "validation": {
      "type": "object",
      "additionalProperties": false,
      "required": ["expression", "message", "field"],
      "properties": {
        "expression": { "type": "string", "minLength": 1, "x-axis-expression": true },
        "message": { "$ref": "#/$defs/textReference" },
        "field": { "type": "string" }
      }
    },
    "index": {
      "type": "object",
      "additionalProperties": false,
      "required": ["fields"],
      "properties": {
        "fields": {
          "type": "array",
          "minItems": 1,
          "maxItems": 32,
          "uniqueItems": true,
          "items": { "type": "string" }
        },
        "unique": { "type": "boolean" }
      }
    },
    "field": {
      "type": "object",
      "additionalProperties": false,
      "required": ["name", "type"],
      "properties": {
        "name": { "$ref": "#/$defs/name" },
        "type": {
          "enum": ["text", "integer", "decimal", "boolean", "date", "date-time", "enum", "reference", "references", "child-collection", "money", "file"]
        },
        "label": { "$ref": "#/$defs/textReference" },
        "help": { "$ref": "#/$defs/textReference" },
        "required": { "type": "boolean" },
        "unique": { "type": "boolean" },
        "maxLength": { "type": "integer", "minimum": 0, "maximum": 2147483647 },
        "minLength": { "type": "integer", "minimum": 0, "maximum": 2147483647 },
        "min": { "type": ["number", "string"] },
        "max": { "type": ["number", "string"] },
        "precision": { "type": "integer", "minimum": 0, "maximum": 2147483647 },
        "scale": { "type": "integer", "minimum": 0, "maximum": 2147483647 },
        "maxSize": { "type": "integer", "minimum": 0, "maximum": 9007199254740991 },
        "accept": {
          "type": "array",
          "minItems": 1,
          "uniqueItems": true,
          "items": { "type": "string" }
        },
        "target": { "type": "string", "x-axis-reference": "entity" },
        "currency": { "type": "string" },
        "currencyField": { "type": "string" },
        "values": {
          "type": "array",
          "minItems": 1,
          "uniqueItems": true,
          "items": { "type": "string" }
        },
        "valueLabels": {
          "type": "object",
          "additionalProperties": { "$ref": "#/$defs/textReference" }
        },
        "expression": { "type": "string", "minLength": 1, "x-axis-expression": true },
        "sequence": { "type": "string", "x-axis-reference": "sequence" },
        "creator": { "type": "boolean" },
        "searchable": { "type": "boolean" },
        "default": { "type": "string", "minLength": 1, "x-axis-expression": true },
        "sensitive": { "type": "boolean" }
      }
    }
  }
}
