{
  "id": "dcf0a548-ba8a-4927-998a-2cb51ebc3c05",
  "kind": "entity",
  "name": "Request",
  "formatVersion": 1,
  "label": {
    "textKey": "request.label"
  },
  "displayField": "title",
  "fields": [
    {
      "name": "number",
      "type": "text",
      "maxLength": 20,
      "unique": true,
      "sequence": "RequestNumber",
      "label": {
        "textKey": "request.number"
      }
    },
    {
      "name": "requester",
      "type": "text",
      "maxLength": 100,
      "creator": true,
      "label": {
        "textKey": "request.requester"
      }
    },
    {
      "name": "title",
      "type": "text",
      "required": true,
      "maxLength": 200,
      "label": {
        "textKey": "request.title"
      }
    },
    {
      "name": "description",
      "type": "text",
      "maxLength": 2000,
      "label": {
        "textKey": "request.description"
      }
    },
    {
      "name": "status",
      "type": "enum",
      "values": [
        "draft",
        "submitted",
        "approved",
        "rejected"
      ],
      "label": {
        "textKey": "request.status"
      }
    },
    {
      "name": "decisionComment",
      "type": "text",
      "maxLength": 2000,
      "label": {
        "textKey": "request.decisionComment"
      }
    }
  ]
}
