{
  "id": "439ba967-56c6-4043-a55a-14b3a5bf7fcf",
  "kind": "entity",
  "name": "Location",
  "formatVersion": 1,
  "label": {
    "textKey": "location.label"
  },
  "displayField": "name",
  "fields": [
    {
      "name": "name",
      "type": "text",
      "required": true,
      "maxLength": 100,
      "label": {
        "textKey": "location.name"
      }
    }
  ]
}
